{
  "schemaVersion": 1,
  "documentType": "listening-choice-bilingual-options",
  "contentVersion": "1.1.0",
  "courseId": "survival-travel-american-4w",
  "targetLocale": "en-US",
  "supportLocale": "zh-CN",
  "questions": [
    {
      "questionId": "st4w-w1d1-wd-01",
      "sourceKind": "listening-extension",
      "options": [
        {
          "optionId": "a",
          "textEn": "visit",
          "translationZh": "访问"
        },
        {
          "optionId": "b",
          "textEn": "visa",
          "translationZh": "签证"
        },
        {
          "optionId": "c",
          "textEn": "village",
          "translationZh": "村庄"
        }
      ]
    },
    {
      "questionId": "st4w-w1d1-ss-01",
      "sourceKind": "listening-extension",
      "options": [
        {
          "optionId": "a",
          "textEn": "From Shanghai, traveling to Boston this week",
          "translationZh": "来自上海，这周在波士顿旅行"
        },
        {
          "optionId": "b",
          "textEn": "Originally from Boston, traveling to Shanghai this week",
          "translationZh": "来自波士顿，这周在上海旅行"
        },
        {
          "optionId": "c",
          "textEn": "Live in Shanghai, going to Boston next week",
          "translationZh": "住在上海，下周去波士顿"
        }
      ]
    },
    {
      "questionId": "st4w-w1d2-wd-01",
      "sourceKind": "listening-extension",
      "options": [
        {
          "optionId": "a",
          "textEn": "first name",
          "translationZh": "名"
        },
        {
          "optionId": "b",
          "textEn": "last name",
          "translationZh": "姓"
        },
        {
          "optionId": "c",
          "textEn": "phone number",
          "translationZh": "电话号码"
        }
      ]
    },
    {
      "questionId": "st4w-w1d2-ss-01",
      "sourceKind": "listening-extension",
      "options": [
        {
          "optionId": "a",
          "textEn": "Spell the message just now",
          "translationZh": "拼写刚才的信息"
        },
        {
          "optionId": "b",
          "textEn": "Say the phone number again",
          "translationZh": "再说一次电话号码"
        },
        {
          "optionId": "c",
          "textEn": "Fill in your email address",
          "translationZh": "填写电子邮箱地址"
        }
      ]
    },
    {
      "questionId": "st4w-w1d3-wd-01",
      "sourceKind": "listening-extension",
      "options": [
        {
          "optionId": "a",
          "textEn": "fifteen",
          "translationZh": "十五"
        },
        {
          "optionId": "b",
          "textEn": "fifty",
          "translationZh": "五十"
        },
        {
          "optionId": "c",
          "textEn": "five",
          "translationZh": "五"
        }
      ]
    },
    {
      "questionId": "st4w-w1d3-ss-01",
      "sourceKind": "listening-extension",
      "options": [
        {
          "optionId": "a",
          "textEn": "1 dollar 15 cents",
          "translationZh": "1 美元 15 美分"
        },
        {
          "optionId": "b",
          "textEn": "1 dollar 50 cents",
          "translationZh": "1 美元 50 美分"
        },
        {
          "optionId": "c",
          "textEn": "$15",
          "translationZh": "15 美元"
        }
      ]
    },
    {
      "questionId": "st4w-w1d4-wd-01",
      "sourceKind": "listening-extension",
      "options": [
        {
          "optionId": "a",
          "textEn": "nine thirteen",
          "translationZh": "九点十三分"
        },
        {
          "optionId": "b",
          "textEn": "nine thirty",
          "translationZh": "九点三十分"
        },
        {
          "optionId": "c",
          "textEn": "nine o'clock",
          "translationZh": "九点钟"
        }
      ]
    },
    {
      "questionId": "st4w-w1d4-ss-01",
      "sourceKind": "listening-extension",
      "options": [
        {
          "optionId": "a",
          "textEn": "Meet at 9:30 and have coffee first",
          "translationZh": "9:30 见面，先喝咖啡"
        },
        {
          "optionId": "b",
          "textEn": "Meet at 10:00 and visit the museum first",
          "translationZh": "10:00 见面，先参观博物馆"
        },
        {
          "optionId": "c",
          "textEn": "9:13 Go directly to the hotel",
          "translationZh": "9:13 直接去酒店"
        }
      ]
    },
    {
      "questionId": "st4w-w1d5-wd-01",
      "sourceKind": "listening-extension",
      "options": [
        {
          "optionId": "a",
          "textEn": "repeat",
          "translationZh": "重复"
        },
        {
          "optionId": "b",
          "textEn": "receipt",
          "translationZh": "收据"
        },
        {
          "optionId": "c",
          "textEn": "restroom",
          "translationZh": "卫生间"
        }
      ]
    },
    {
      "questionId": "st4w-w1d5-ss-01",
      "sourceKind": "listening-extension",
      "options": [
        {
          "optionId": "a",
          "textEn": "Ask the other person to repeat and speak slower",
          "translationZh": "请对方重复并说慢一点"
        },
        {
          "optionId": "b",
          "textEn": "Ask the person to lead the way to the front desk",
          "translationZh": "请对方带路去前台"
        },
        {
          "optionId": "c",
          "textEn": "Ask the other person to wait by the elevator",
          "translationZh": "请对方等在电梯旁"
        }
      ]
    },
    {
      "questionId": "st4w-w1d6-wd-01",
      "sourceKind": "listening-extension",
      "options": [
        {
          "optionId": "a",
          "textEn": "takeout",
          "translationZh": "外带"
        },
        {
          "optionId": "b",
          "textEn": "checkout",
          "translationZh": "结账"
        },
        {
          "optionId": "c",
          "textEn": "table",
          "translationZh": "桌子"
        }
      ]
    },
    {
      "questionId": "st4w-w1d6-ss-01",
      "sourceKind": "listening-extension",
      "options": [
        {
          "optionId": "a",
          "textEn": "Dine in or take out?",
          "translationZh": "堂食还是外带"
        },
        {
          "optionId": "b",
          "textEn": "Whether to add milk",
          "translationZh": "是否加牛奶"
        },
        {
          "optionId": "c",
          "textEn": "sandwich size",
          "translationZh": "三明治的大小"
        }
      ]
    },
    {
      "questionId": "st4w-w1d7-wd-01",
      "sourceKind": "listening-extension",
      "options": [
        {
          "optionId": "a",
          "textEn": "nine thirteen",
          "translationZh": "九点十三分"
        },
        {
          "optionId": "b",
          "textEn": "nine thirty",
          "translationZh": "九点三十分"
        },
        {
          "optionId": "c",
          "textEn": "nine forty",
          "translationZh": "九点四十"
        }
      ]
    },
    {
      "questionId": "st4w-w1d7-ss-01",
      "sourceKind": "listening-extension",
      "options": [
        {
          "optionId": "a",
          "textEn": "Check if it's 9:13 or 9:30",
          "translationZh": "要确认是 9:13 还是 9:30"
        },
        {
          "optionId": "b",
          "textEn": "Want to cancel plans for tomorrow",
          "translationZh": "要取消明天的计划"
        },
        {
          "optionId": "c",
          "textEn": "Change the meeting place to a hotel",
          "translationZh": "要把见面地点改到酒店"
        }
      ]
    },
    {
      "questionId": "st4w-w2d8-wd-01",
      "sourceKind": "listening-extension",
      "options": [
        {
          "optionId": "a",
          "textEn": "reservation",
          "translationZh": "预订"
        },
        {
          "optionId": "b",
          "textEn": "recommendation",
          "translationZh": "推荐"
        },
        {
          "optionId": "c",
          "textEn": "restaurant",
          "translationZh": "餐厅"
        }
      ]
    },
    {
      "questionId": "st4w-w2d8-ss-01",
      "sourceKind": "listening-extension",
      "options": [
        {
          "optionId": "a",
          "textEn": "about 5 minutes",
          "translationZh": "大约 5 分钟"
        },
        {
          "optionId": "b",
          "textEn": "about 10 minutes",
          "translationZh": "大约 10 分钟"
        },
        {
          "optionId": "c",
          "textEn": "about 30 minutes",
          "translationZh": "大约 30 分钟"
        }
      ]
    },
    {
      "questionId": "st4w-w2d9-wd-01",
      "sourceKind": "listening-extension",
      "options": [
        {
          "optionId": "a",
          "textEn": "allergic",
          "translationZh": "过敏的"
        },
        {
          "optionId": "b",
          "textEn": "allergy",
          "translationZh": "过敏"
        },
        {
          "optionId": "c",
          "textEn": "appetizer",
          "translationZh": "开胃菜"
        }
      ]
    },
    {
      "questionId": "st4w-w2d9-ss-01",
      "sourceKind": "listening-extension",
      "options": [
        {
          "optionId": "a",
          "textEn": "allergic to peanuts",
          "translationZh": "对花生过敏"
        },
        {
          "optionId": "b",
          "textEn": "don't like onions",
          "translationZh": "不喜欢洋葱"
        },
        {
          "optionId": "c",
          "textEn": "Want to change it to French fries",
          "translationZh": "想换成薯条"
        }
      ]
    },
    {
      "questionId": "st4w-w2d10-wd-01",
      "sourceKind": "listening-extension",
      "options": [
        {
          "optionId": "a",
          "textEn": "check",
          "translationZh": "账单"
        },
        {
          "optionId": "b",
          "textEn": "cash",
          "translationZh": "现金"
        },
        {
          "optionId": "c",
          "textEn": "charge",
          "translationZh": "收费"
        }
      ]
    },
    {
      "questionId": "st4w-w2d10-ss-01",
      "sourceKind": "listening-extension",
      "options": [
        {
          "optionId": "a",
          "textEn": "One more drink was added to the bill",
          "translationZh": "账单多算了一杯饮料"
        },
        {
          "optionId": "b",